index,brand,id,name,num_reviews,rating,total_stars,bayesian_est
/benefiance-wrinkleresist24-intensive-eye-contour-cream-P173620,Shiseido,P173620,Benefiance WrinkleResist24 Intensive Eye Contour Cream,1342,4.3234,5802.0028,4.31361153846
/renew-hydrate-eye-cream-P293902,bareMinerals,P293902,Renew & Hydrate Eye Cream,1362,4.2878,5839.9836,4.27841370262
/all-about-eyes-rich-P174502,CLINIQUE,P174502,All About Eyes™ Rich,1168,4.2226,4931.9968,4.21222139219
/mega-rich-intensive-anti-aging-cellular-eye-creme-P116610,Peter Thomas Roth,P116610,Mega Rich Intensive Anti-Aging Cellular Eye Creme,203,4.2463,861.9989,4.18778826291
/hope-in-a-tube-eye-lip-cream-P12090,philosophy,P12090,Hope In A Tube Eye & Lip Cream,713,4.1935,2989.9655,4.17699239281
/rose-hydrating-eye-gel-cream-P386741,Fresh,P386741,Rose Hydrating Eye Gel Cream,251,4.1992,1053.9992,4.15325363985
/premier-cru-the-eye-cream-P280104,Caudalie,P280104,Premier Cru The Eye Cream,357,4.1653,1487.0121,4.1335479564
/super-restorative-total-eye-concentrate-P95040,Clarins,P95040,Super Restorative Total Eye Concentrate,142,4.2042,596.9964,4.12497631579
/immortelle-eye-balm-P39912,L'Occitane,P39912,Immortelle Eye Balm,197,4.1777,823.0069,4.12080628019
/hydrating-eye-cream-P270544,Bobbi Brown,P270544,Hydrating Eye Cream,270,4.1556,1122.012,4.11432857143
/repairwear-anti-gravity-eye-lift-cream-P122727,CLINIQUE,P122727,Repairwear Anti-Gravity Eye Lift Cream,230,4.1609,957.007,4.11252916667
/creme-ancienne-eye-cream-P268416,Fresh,P268416,Crème Ancienne Eye Cream,71,4.2676,302.9996,4.11110617284
/hypoallergenic-firming-eye-cream-P294204,Perricone MD,P294204,Hypoallergenic Firming Eye Cream,160,4.175,668.0,4.10588235294
/fresh-start-eye-creme-P42326,Ole Henriksen,P42326,Fresh Start Eye Creme,305,4.1311,1259.9855,4.09519206349
/all-about-eyes-P122774,CLINIQUE,P122774,All About Eyes,1366,4.0842,5579.0172,4.07632063953
/complete-eye-renewal-balm-P282938,Algenist,P282938,Complete Eye Renewal Balm,480,4.075,1956.0,4.05306122449
/hydra-life-bb-eye-creme-P378900,Dior,P378900,Hydra Life BB Eye Crème,114,4.1404,472.0056,4.04843225806
/extra-eye-repair-cream-P270600,Bobbi Brown,P270600,Extra Eye Repair Cream,82,4.1707,341.9974,4.04345
/sun-protection-eye-cream-broad-spectrum-spf-34-sunscreen-P384788,Shiseido,P384788,Sun Protection Eye Cream Broad Spectrum SPF 34 Sunscreen,22,4.5,99.0,4.03125
/renewing-eye-cream-P107306,Murad,P107306,Renewing Eye Cream,154,4.0974,630.9996,4.03048536585
/eye-doctor-moisture-care-for-skin-around-eyes-P297531,Origins,P297531,Eye Doctor™ Moisture Care For Skin Around Eyes,258,4.0698,1050.0084,4.02988208955
/hydra-life-pro-youth-sorbet-eye-creme-P259406,Dior,P259406,Hydra Life Pro-Youth Sorbet Eye Crème,196,4.0765,798.994,4.02424271845
/do-not-age-with-dr-brandt-triple-peptide-eye-cream-P383053,Dr. Brandt Skincare,P383053,Do Not Age with Dr. Brandt Triple Peptide Eye Cream,75,4.16,312.0,4.02352941176
/high-performance-continuous-moisture-eye-cream-P72706,Anthony,P72706,High Performance Continuous Moisture Eye Cream,34,4.3235,146.999,4.02270454545
/eye-duty-triple-remedy-brighten-depuff-smooth-P385329,First Aid Beauty,P385329,"Eye Duty Triple Remedy: Brighten, Depuff and Smooth",359,4.0362,1448.9958,4.00811869919
/future-solution-lx-eye-lip-contour-regenerating-cream-P277505,Shiseido,P277505,Future Solution LX Eye and Lip Contour Regenerating Cream,50,4.2,210.0,4.0
/maracuja-c-brighter-eye-treatment-P377545,tarte,P377545,Maracuja C-Brighter™ Eye Treatment,444,4.0225,1785.99,3.99997797357
/purely-age-defying-eye-cream-P224520,Jurlique,P224520,Purely Age-Defying Eye Cream,76,4.1184,312.9984,3.98835348837
/plantscription-anti-aging-power-eye-cream-P394702,Origins,P394702,Plantscription™ Anti-Aging Power Eye Cream,54,4.1667,225.0018,3.984403125
/eye-dew-total-eye-cream-P400250,Farmacy,P400250,Eye Dew Total Eye Cream,22,4.4091,97.0002,3.96875625
/hydra-pure-firming-eye-cream-P184115,Dr. Dennis Gross Skincare,P184115,Hydra-Pure® Firming Eye Cream,42,4.1905,176.001,3.96155769231
/total-age-defy-cream-for-eyes-lips-P393280,SEPHORA COLLECTION,P393280,Total Age Defy Cream for Eyes & Lips,64,4.0938,262.0032,3.94598918919
/hydro-dynamic-ultimate-moisture-for-eyes-P293206,Murad,P293206,Hydro-Dynamic® Ultimate Moisture For Eyes,61,4.082,249.002,3.9296056338
/ultimate-lift-eye-creme-P399110,Ole Henriksen,P399110,Ultimate Lift Eye Crème,43,4.1395,177.9985,3.9245
/essential-c-eye-cream-spf-15-pa-P12869,Murad,P12869,Essential-C Eye Cream SPF 15 PA++,233,3.9614,923.0062,3.92183621399
/kakadu-c-eye-souffle-P396403,DERMAdoctor,P396403,Kakadu C™ Eye Soufflé,15,4.5333,67.9995,3.91998
/ginzing-refreshing-eye-cream-P297511,Origins,P297511,GinZing™ Refreshing Eye Cream,1464,3.9057,5717.9448,3.89955549525
/5-in-1-eye-cream-P288522,First Aid Beauty,P288522,5 in 1 Eye Cream,186,3.9355,732.003,3.88777040816
/bio-performance-super-corrective-eye-cream-P378348,Shiseido,P378348,Bio-Performance Super Corrective Eye Cream,86,3.9884,343.0024,3.88544166667
/quercetin-oak-antiageing-antiwrinkle-eye-cream-P264613,KORRES,P264613,Quercetin & Oak Antiageing Antiwrinkle Eye Cream,252,3.9087,984.9924,3.87401679389
/capture-xp-ultimate-wrinkle-correction-eye-creme-P201720,Dior,P201720,Capture XP Ultimate Wrinkle Correction Eye Creme,47,4.0426,190.0022,3.8596877193
/eye-lift-firming-treatment-P404007,Murad,P404007,Eye Lift Firming Treatment,11,4.6364,51.0004,3.85716190476
/superdefense-spf-20-age-defense-eye-cream-P385634,CLINIQUE,P385634,Superdefense SPF 20 Age Defense Eye Cream,32,4.125,132.0,3.85714285714
/it-s-potent-eye-cream-P283509,Benefit Cosmetics,P283509,It's Potent! Eye Cream,491,3.8635,1896.9785,3.84626447106
/advanced-renewal-eye-complex-P385676,NUDE Skincare,P385676,Advanced Renewal Eye Complex,64,3.9688,254.0032,3.83788108108
/high-resolution-eye-refill-3x-P229401,Lancôme,P229401,HIGH RÉSOLUTION EYE REFILL-3X™,72,3.9306,283.0032,3.81711219512
/le-soin-noir-eye-P272317,Givenchy,P272317,Le Soin Noir Eye,21,4.1905,88.0005,3.80646774194
/polyphenol-c15-anti-wrinkle-eye-lip-cream-P386800,Caudalie,P386800,Polyphenol C15 Anti-Wrinkle Eye & Lip Cream,70,3.9143,274.001,3.8000125
/abeille-royale-up-lifting-eye-care-P293803,Guerlain,P293803,Abeille Royale Up-Lifting Eye Care,24,4.125,99.0,3.79411764706
/total-truth-vitamin-c-eye-creme-spf-15-P291520,Ole Henriksen,P291520,Total Truth™ Vitamin C Eye Crème SPF 15,169,3.8343,647.9967,3.78769106145
/miracle-worker-retinoid-eye-repair-cream-P377330,philosophy,P377330,Miracle Worker Retinoid Eye Repair Cream,247,3.8178,942.9966,3.78597898833
/renergie-lift-multi-action-eye-P376136,Lancôme,P376136,Rénergie Lift Multi-Action Eye,53,3.9245,207.9985,3.77775396825
/all-in-one-b-b-eye-brightener-broad-spectrum-spf-20-P387069,boscia,P387069,All-In One B.B. Eye Brightener Broad Spectrum SPF 20,39,3.9744,155.0016,3.77554285714
/no-concealer-concealer-spf-35-P311147,Perricone MD,P311147,No Concealer Concealer SPF 35,147,3.8231,561.9957,3.77067324841
/line-release-under-eye-repair-cream-P232920,Kate Somerville,P232920,Line Release Under Eye Repair Cream,59,3.8814,229.0026,3.75366086957
/vinosource-s-o-s-morning-eye-rescue-P379068,Caudalie,P379068,Vinosource S.O.S. Morning Eye Rescue,85,3.8353,326.0005,3.74737368421
/renewed-hope-in-jar-eye-P392233,philosophy,P392233,Renewed Hope In A Jar Eye,65,3.8615,250.9975,3.74663333333
/repairwear-laser-focus-wrinkle-correcting-eye-cream-P377576,CLINIQUE,P377576,Repairwear Laser Focus Wrinkle Correcting Eye Cream,105,3.8095,399.9975,3.73910869565
/glow-by-dr-brandt-revitalizing-retinol-eye-cream-P377124,Dr. Brandt Skincare,P377124,glow by dr. brandt™ revitalizing retinol eye cream,75,3.8133,285.9975,3.71761764706
/eye-contour-balm-P94818,Clarins,P94818,Eye Contour Balm,45,3.8444,172.998,3.69087272727
/professional-strength-micropoint-pm-patch-system-advanced-eye-wrinkle-treatment-P404324,Peter Thomas Roth,P404324,PROfessional Strength MicroPoint PM Patch System Advanced Eye Wrinkle Treatment,6,4.8333,28.9998,3.6874875
/resveratrol-lift-eye-lifting-balm-P400610,Caudalie,P400610,Resveratrol Lift Eye Lifting Balm,32,3.875,124.0,3.66666666667
/black-pine-firming-antiwrinkle-lifting-eye-cream-P387649,KORRES,P387649,"Black Pine Firming, Lifting & Antiwrinkle Eye Cream",45,3.8,171.0,3.65454545455
/shaba-complex-eye-serum-P397391,Drunk Elephant,P397391,Shaba Complex™ Eye Serum,24,3.9167,94.0008,3.64708235294
/age-arrest-eye-cream-P383308,Kate Somerville,P383308,Age Arrest Eye Cream,21,3.9524,83.0004,3.64517419355
/ultimate-lift-eye-gel-tm-P387216,Ole Henriksen,P387216,Ultimate Lift Eye Gel™,213,3.6714,782.0082,3.64129237668
/moisturizing-firming-eye-cream-P394640,belif,P394640,Moisturizing & Firming Eye Cream,23,3.8696,89.0008,3.60608484848
/advanced-anti-aging-eye-cream-broad-spectrum-sunscreen-spf-37-P382079,Supergoop!,P382079,Advanced Anti-Aging Eye Cream Broad Spectrum Sunscreen SPF 37,43,3.7442,161.0006,3.60378490566
/ibuki-eye-correcting-cream-P381195,Shiseido,P381195,IBUKI Eye Correcting Cream,60,3.7,222.0,3.6
/abeille-royale-gold-eyetech-eye-sculpt-serum-P403606,Guerlain,P403606,Abeille Royale Gold Eyetech Eye Sculpt Serum,5,4.8,24.0,3.6
/cold-plasma-eye-P262702,Perricone MD,P262702,Cold Plasma Eye,159,3.6352,577.9968,3.59761420118
/lotus-youth-preserve-eye-cream-P392865,Fresh,P392865,Lotus Youth Preserve Eye Cream,57,3.7018,211.0026,3.59705373134
/intensive-vitalizing-eye-essence-P394619,AmorePacific,P394619,Intensive Vitalizing Eye Essence,29,3.7931,109.9999,3.58974102564
/eye-duty-triple-remedy-overnight-balm-P393601,First Aid Beauty,P393601,Eye Duty Triple Remedy Overnight Balm,75,3.6533,273.9975,3.57644117647
/white-lucent-anti-dark-circles-eye-cream-P205614,Shiseido,P205614,White Lucent Anti-Dark Circles Eye Cream,221,3.6018,795.9978,3.57574805195
/puff-off-P392379,Benefit Cosmetics,P392379,Puff Off!,171,3.6082,617.0022,3.57459779006
/future-response-age-defense-dual-eye-creme-P386926,AmorePacific,P386926,Future Response Age Defense Dual Eye Creme,42,3.6905,155.001,3.55771153846
/reviving-eye-cream-P309211,Omorovicza,P309211,Reviving Eye Cream,8,4.25,34.0,3.55555555556
/time-in-a-bottle-tm-for-eyes-P385346,philosophy,P385346,Time In A Bottle™ For Eyes,41,3.6829,150.9989,3.54899803922
/cytocell-dark-circle-corrective-eye-cream-P286709,Kate Somerville,P286709,CytoCell™ Dark Circle Corrective Eye Cream,97,3.5979,348.9963,3.54202149533
/keep-young-beautiful-anti-ageing-eye-cream-P377003,REN,P377003,Keep Young and Beautiful Anti-Ageing Eye Cream,33,3.697,122.001,3.53490697674
/genius-ultimate-anti-aging-eye-cream-P388262,Algenist,P388262,Genius Ultimate Anti-Aging Eye Cream,58,3.6207,210.0006,3.52942058824
/ultimate-miracle-worker-eye-cream-P398832,philosophy,P398832,Ultimate Miracle Worker Eye Cream,13,3.9231,51.0003,3.52175217391
/lift-lighten-eye-cream-P78325,Dr. Dennis Gross Skincare,P78325,Lift & Lighten Eye Cream,70,3.5571,248.997,3.4874625
/restorative-eye-creme-P386739,Tata Harper,P386739,Restorative Eye Creme,21,3.7143,78.0003,3.48388064516
/essential-power-eye-cream-P394692,SK-II,P394692,Essential Power Eye Cream,7,4.1429,29.0003,3.47060588235
/facial-treatment-essence-eye-P390175,SK-II,P390175,Facial Treatment Essence - Eye,6,4.1667,25.0002,3.4375125
/eye-revive-creme-P383063,Radical Skincare,P383063,Eye Revive Crème,16,3.6875,59.0,3.42307692308
/absolue-premium-bx-absolute-replenishing-eye-cream-P158705,Lancôme,P158705,ABSOLUE PREMIUM Bx - Absolute Replenishing Eye Cream,21,3.619,75.999,3.41932258065
/eye-contour-lifting-cream-P399748,Lancer,P399748,Eye Contour Lifting Cream,15,3.6667,55.0005,3.40002
/illumnikate-concealing-eye-cream-P387262,Kate Somerville,P387262,IllumniKate ™ Concealing Eye Cream,13,3.6923,47.9999,3.3913
/nutri-define-eye-contour-balm-P399982,Jurlique,P399982,Nutri-Define Eye Contour Balm,4,4.25,17.0,3.35714285714
/dr-andrew-weil-for-origins-tm-mega-bright-dark-circle-minimizer-P384394,Origins,P384394,Dr. Andrew Weil for Origins™ Mega-Bright Dark Circle Minimizer,98,3.3469,327.9962,3.31477962963
/ice-cold-eye-cream-P399714,Kenzoki,P399714,Ice-Cold Eye Cream,6,3.8333,22.9998,3.3124875
/flawless-skin-repair-eye-creme-P280936,Laura Mercier,P280936,Flawless Skin Repair Eye Crème,12,3.5,42.0,3.27272727273
/belle-de-jour-angel-eyes-white-lotus-care-P399728,Kenzoki,P399728,Belle de Jour Angel Eyes White Lotus Care,6,3.6667,22.0002,3.2500125
/lotus-caress-to-moisturize-eyes-P399712,Kenzoki,P399712,Lotus Caress to Moisturize Eyes,2,4.5,9.0,3.25
/herbal-recovery-advanced-eye-serum-P393717,Jurlique,P393717,Herbal Recovery Advanced Eye Serum,4,3.75,15.0,3.21428571429
/resilience-lift-firming-sculpting-eye-creme-P380026,Estée Lauder,P380026,Resilience Lift Firming/Sculpting Eye Creme,4,3.75,15.0,3.21428571429
/divine-eyes-P396251,L'Occitane,P396251,Divine Eyes,3,3.6667,11.0001,3.15385384615
/ferulic-retinol-eye-cream-P388622,Dr. Dennis Gross Skincare,P388622,Ferulic + Retinol Eye Cream,27,3.1852,86.0004,3.13514594595
/dark-circles-away-collagen-eye-serum-P289000,Dr. Brandt Skincare,P289000,dark circles away™ collagen eye serum,180,3.1167,561.006,3.11055789474
/purely-bright-eye-correcting-cream-P386506,Jurlique,P386506,Purely Bright Eye Correcting Cream,6,3.1667,19.0002,3.0625125
/dr-weil-for-origins-mega-mushroom-skin-relief-eye-serum-P402730,Origins,P402730,Dr. Weil For Origins™ Mega-Mushroom Skin Relief Eye Serum,0,0,0.0,3.0
/total-replenishing-eye-cream-P402134,NARS,P402134,Total Replenishing Eye Cream,0,0,0.0,3.0
/pep-start-eye-cream-P403817,CLINIQUE,P403817,Pep-Start Eye Cream,26,4,104.0,3.0
/artist-secret-radiant-eye-P394623,Embryolisse,P394623,Artist Secret Radiant Eye,5,3,15.0,3.0
/power-advanced-wrinkle-fighter-360-eye-serum-P404169,Algenist,P404169,POWER Advanced Wrinkle Fighter 360° Eye Serum,1,5,5.0,3.0
/defining-eye-lift-P398838,Clarins,P398838,Defining Eye Lift,0,0,0.0,3.0
/extra-firming-eye-wrinkle-smoothing-cream-P393254,Clarins,P393254,Extra-Firming Eye Wrinkle Smoothing Cream,1,4,4.0,3.0
/xtend-your-youth-eye-cream-P383056,Dr. Brandt Skincare,P383056,Xtend Your Youth Eye Cream,10,2.7,27.0,2.85
/no-reason-to-hide-dark-circle-transforming-eye-cream-P397930,philosophy,P397930,No Reason to Hide Dark Circle Transforming Eye Cream,3,2.3333,6.9999,2.84614615385
/bio-performance-glow-revival-eye-treatment-P403318,Shiseido,P403318,Bio Performance Glow Revival Eye Treatment,2,1.5,3.0,2.75
/visionnaire-eye-cream-P382549,Lancôme,P382549,Visionnaire Eye Cream,13,2.5385,33.0005,2.73915217391
/start-over-active-eye-gel-cream-P398122,Sunday Riley,P398122,Start Over Active Eye Gel Cream,7,1,7.0,2.0
/nourishing-eye-renewal-cream-P398819,Tria,P398819,Nourishing Eye Renewal Cream,1,1,1.0,2.0
